{
  "schema": "famtutor.case.v1",
  "caseId": "zj8a-1-1-06-median",
  "title": "构造三角形中线",
  "description": "先确定边 BC 的中点 M，再连接顶点 A 与 M，形成中线 AM。",
  "source": { "bookId": "zjedu-math-8a-2013", "pdfName": "义务教育教科书·数学八年级上册.pdf", "pdfSha256": "d0888daf868964e0b04a7b22f09b24fa24b001becf7c3a617c5f799f1fa078f2", "chapter": "1 三角形的初步知识", "section": "1.1 认识三角形", "printedPages": [7], "pdfPages": [10], "extractionMethod": "visual-review", "confidence": 1, "reviewStatus": "reviewed" },
  "knowledgePoints": ["median"],
  "learningObjective": "理解中线连接顶点与对边中点，并能用等长关系验证中点。",
  "caseType": "guided-construction",
  "difficulty": "introductory",
  "requiredCapabilities": ["point.midpoint", "segment.through_points", "assertion.expression_equal", "activity.stages"],
  "generation": { "provider": "openai-codex", "model": "gpt-5", "promptVersion": "pr6-seed-v1", "seed": 106, "attempts": 1 },
  "inputs": { "initialDocument": { "schema": "famtutor.math.document.v1", "documentId": "median-06", "revision": 1, "seed": 106, "metadata": { "title": "三角形中线", "locale": "zh-CN", "purpose": "demonstration", "subject": "mathematics", "grade": "grade-8" }, "entities": [], "construction": [], "views": [{ "id": "main", "kind": "graphics2d", "visible": true, "renderer": "jsxgraph-svg", "boundingBox": [-5, 6, 5, -2], "axes": false, "grid": false, "keepAspectRatio": true }], "activities": [{ "id": "construct-median", "title": "构造中线", "stages": [{ "id": "triangle", "narration": "构造三角形 ABC。", "reveal": ["triangle"] }, { "id": "midpoint", "narration": "作 BC 的中点 M。", "reveal": ["M"] }, { "id": "median", "narration": "连接 A、M 得到中线。", "reveal": ["AM"] }] }], "provenance": { "generator": "agent", "sourceRefs": ["zjedu-math-8a-2013:printed-7"] } } },
  "trace": { "changeSets": [{ "schema": "famtutor.engine.change-set.v1", "changeSetId": "zj8a-06-build", "base": { "domain": "math", "schema": "famtutor.math.document.v1", "documentId": "median-06", "revision": 1 }, "operations": [
    { "op": "construct", "command": "point.free", "outputs": [{ "id": "A", "label": "A" }], "params": { "coords": [0, 5] } },
    { "op": "construct", "command": "point.free", "outputs": [{ "id": "B", "label": "B" }], "params": { "coords": [-4, 0] } },
    { "op": "construct", "command": "point.free", "outputs": [{ "id": "C", "label": "C" }], "params": { "coords": [4, 0] } },
    { "op": "construct", "command": "polygon.vertices", "outputs": [{ "id": "triangle", "label": "△ABC" }], "inputs": [{ "ref": "A" }, { "ref": "B" }, { "ref": "C" }] },
    { "op": "construct", "command": "point.midpoint", "outputs": [{ "id": "M", "label": "M" }], "inputs": [{ "ref": "B" }, { "ref": "C" }] },
    { "op": "construct", "command": "segment.through_points", "outputs": [{ "id": "AM", "label": "AM" }], "inputs": [{ "ref": "A" }, { "ref": "M" }] },
    { "op": "add_assertion", "assertion": { "id": "midpoint-equal-halves", "predicate": "expression_equal", "arguments": [{ "expr": "distance(B,M)" }, { "expr": "distance(M,C)" }], "tolerance": 1e-9, "message": "M 是 BC 的中点。" } }
  ], "metadata": { "origin": "textbook-case-seed" } }] },
  "expected": { "documentFingerprint": "21a6e526bf0e63bbd23c23e27040c3d5bcc36fcca556ff65732b7b1f30ec9fe2", "assertions": [{ "kind": "entity-exists", "entityIds": ["A", "B", "C", "triangle", "M", "AM"] }, { "kind": "entity-types", "types": { "M": "point2", "AM": "segment2" } }, { "kind": "runtime-assertions-pass" }, { "kind": "activity-stages", "minimum": 3 }, { "kind": "static-render" }, { "kind": "render-bundle" }], "interactions": [] },
  "artifacts": {}, "status": "accepted", "diagnostics": []
}
