{
  "schema": "famtutor.case.v1",
  "caseId": "zj8a-1-1-02-drag-angle-sum",
  "title": "拖动三角形观察内角和",
  "description": "拖动三个顶点改变三角形形状，并持续验证内角和为 180°。",
  "source": { "bookId": "zjedu-math-8a-2013", "pdfName": "义务教育教科书·数学八年级上册.pdf", "pdfSha256": "d0888daf868964e0b04a7b22f09b24fa24b001becf7c3a617c5f799f1fa078f2", "chapter": "1 三角形的初步知识", "section": "1.1 认识三角形", "printedPages": [4], "pdfPages": [7], "extractionMethod": "visual-review", "confidence": 1, "reviewStatus": "reviewed" },
  "knowledgePoints": ["triangle-angle-sum"],
  "learningObjective": "在拖动形成的多个非退化三角形中验证内角和不变。",
  "caseType": "exploration",
  "difficulty": "introductory",
  "requiredCapabilities": ["point.free", "polygon.vertices", "interaction.drag", "assertion.expression_equal"],
  "generation": { "provider": "openai-codex", "model": "gpt-5", "promptVersion": "pr6-seed-v1", "seed": 102, "attempts": 1 },
  "inputs": { "initialDocument": { "schema": "famtutor.math.document.v1", "documentId": "drag-angle-sum-02", "revision": 1, "seed": 102, "metadata": { "title": "拖动三角形观察内角和", "locale": "zh-CN", "purpose": "exploration", "subject": "mathematics", "grade": "grade-8" }, "entities": [], "construction": [], "views": [{ "id": "main", "kind": "graphics2d", "visible": true, "renderer": "jsxgraph-svg", "boundingBox": [-6, 6, 6, -5], "axes": false, "grid": false, "keepAspectRatio": true }], "activities": [{ "id": "drag-and-observe", "title": "拖动并观察", "stages": [{ "id": "initial", "narration": "记录初始三角形的三个角。" }, { "id": "drag", "narration": "拖动任一顶点，再检查内角和。", "focus": ["A", "B", "C"] }] }], "provenance": { "generator": "agent", "sourceRefs": ["zjedu-math-8a-2013:printed-4"] } } },
  "trace": { "changeSets": [{ "schema": "famtutor.engine.change-set.v1", "changeSetId": "zj8a-02-build", "base": { "domain": "math", "schema": "famtutor.math.document.v1", "documentId": "drag-angle-sum-02", "revision": 1 }, "operations": [
    { "op": "construct", "command": "point.free", "outputs": [{ "id": "A", "label": "A" }], "params": { "coords": [-3, -2] } },
    { "op": "construct", "command": "point.free", "outputs": [{ "id": "B", "label": "B" }], "params": { "coords": [3, -2] } },
    { "op": "construct", "command": "point.free", "outputs": [{ "id": "C", "label": "C" }], "params": { "coords": [1, 3] } },
    { "op": "construct", "command": "polygon.vertices", "outputs": [{ "id": "triangle", "label": "△ABC" }], "inputs": [{ "ref": "A" }, { "ref": "B" }, { "ref": "C" }] },
    { "op": "construct", "command": "angle.three_points", "outputs": [{ "id": "angleA", "label": "∠A" }], "inputs": [{ "ref": "B" }, { "ref": "A" }, { "ref": "C" }] },
    { "op": "construct", "command": "angle.three_points", "outputs": [{ "id": "angleB", "label": "∠B" }], "inputs": [{ "ref": "A" }, { "ref": "B" }, { "ref": "C" }] },
    { "op": "construct", "command": "angle.three_points", "outputs": [{ "id": "angleC", "label": "∠C" }], "inputs": [{ "ref": "A" }, { "ref": "C" }, { "ref": "B" }] },
    { "op": "set_interaction", "policy": { "target": "A", "permissions": ["select", "drag"], "dragMode": "free" } },
    { "op": "set_interaction", "policy": { "target": "B", "permissions": ["select", "drag"], "dragMode": "free" } },
    { "op": "set_interaction", "policy": { "target": "C", "permissions": ["select", "drag"], "dragMode": "free" } },
    { "op": "add_assertion", "assertion": { "id": "angle-sum-after-drag", "predicate": "expression_equal", "arguments": [{ "expr": "angle(B,A,C)+angle(A,B,C)+angle(A,C,B)" }, { "value": 3.141592653589793 }], "tolerance": 1e-9, "message": "拖动后内角和仍为 180°。" } }
  ], "metadata": { "origin": "textbook-case-seed" } }] },
  "expected": { "documentFingerprint": "83b8040db809e67bd8a94de7d551026e419aa86f668e18e9b2465459096a0e56", "assertions": [{ "kind": "entity-exists", "entityIds": ["A", "B", "C", "triangle", "angleA", "angleB", "angleC"] }, { "kind": "runtime-assertions-pass" }, { "kind": "activity-stages", "minimum": 2 }, { "kind": "static-render" }, { "kind": "render-bundle" }], "interactions": [{ "target": "A", "permission": "drag" }, { "target": "B", "permission": "drag" }, { "target": "C", "permission": "drag" }] },
  "artifacts": {}, "status": "accepted", "diagnostics": []
}
