{
  "schema": "famtutor.case.v1",
  "caseId": "zj8a-1-2-14-definition-right-triangle",
  "title": "定义中的必要条件",
  "description": "按教材印刷页 10–11实现的来源可追溯几何案例。",
  "source": {
    "bookId": "zjedu-math-8a-2013",
    "pdfName": "义务教育教科书·数学八年级上册.pdf",
    "pdfSha256": "d0888daf868964e0b04a7b22f09b24fa24b001becf7c3a617c5f799f1fa078f2",
    "chapter": "1 三角形的初步知识",
    "section": "1.2 定义与命题",
    "printedPages": [
      10,
      11
    ],
    "pdfPages": [
      13,
      14
    ],
    "extractionMethod": "visual-review",
    "confidence": 1,
    "reviewStatus": "reviewed"
  },
  "knowledgePoints": [
    "definition",
    "right-triangle"
  ],
  "learningObjective": "从‘有一个角是直角的三角形’理解定义同时限定对象类别和关键性质。",
  "caseType": "demonstration",
  "difficulty": "introductory",
  "requiredCapabilities": [
    "polygon.vertices",
    "marker.right_angle",
    "assertion.perpendicular",
    "activity.stages"
  ],
  "generation": {
    "provider": "openai-codex",
    "model": "gpt-5",
    "promptVersion": "ch1-source-faithful-v2",
    "seed": 214,
    "attempts": 1
  },
  "inputs": {
    "initialDocument": {
      "schema": "famtutor.math.document.v1",
      "documentId": "ch1-14-definition-right-triangle",
      "revision": 1,
      "seed": 214,
      "metadata": {
        "title": "定义中的必要条件",
        "locale": "zh-CN",
        "purpose": "demonstration",
        "subject": "mathematics",
        "grade": "grade-8",
        "tags": [
          "1.2",
          "definition",
          "right-triangle"
        ]
      },
      "entities": [],
      "construction": [],
      "views": [
        {
          "id": "main",
          "kind": "graphics2d",
          "visible": true,
          "renderer": "jsxgraph-svg",
          "boundingBox": [
            -1,
            5,
            6,
            -1
          ],
          "axes": false,
          "grid": false,
          "keepAspectRatio": true,
          "background": "#FAF8F2",
          "cameraPolicy": "stable_across_stages"
        }
      ],
      "activities": [
        {
          "id": "activity-14",
          "title": "定义中的必要条件",
          "stages": [
            {
              "id": "object",
              "narration": "定义先限定对象：它必须是三角形。",
              "reveal": [
                "A",
                "B",
                "C",
                "AB",
                "AC",
                "BC",
                "triangleABC"
              ]
            },
            {
              "id": "property",
              "narration": "再限定关键性质：三个内角中至少有一个是直角。",
              "reveal": [
                "A",
                "B",
                "C",
                "AB",
                "AC",
                "BC",
                "triangleABC",
                "angleA",
                "rightA"
              ]
            },
            {
              "id": "definition",
              "narration": "有一个角是直角的三角形叫做直角三角形；缺少‘三角形’或‘直角’任一条件都不能使用这个定义。",
              "reveal": [
                "A",
                "B",
                "C",
                "AB",
                "AC",
                "BC",
                "triangleABC",
                "angleA",
                "rightA"
              ],
              "focus": [
                "angleA",
                "rightA"
              ]
            }
          ]
        }
      ],
      "provenance": {
        "generator": "agent",
        "sourceRefs": [
          "zjedu-math-8a-2013:printed-10",
          "zjedu-math-8a-2013:printed-11"
        ]
      }
    }
  },
  "trace": {
    "changeSets": [
      {
        "schema": "famtutor.engine.change-set.v1",
        "changeSetId": "zj8a-14-build",
        "base": {
          "domain": "math",
          "schema": "famtutor.math.document.v1",
          "documentId": "ch1-14-definition-right-triangle",
          "revision": 1
        },
        "operations": [
          {
            "op": "construct",
            "command": "point.free",
            "outputs": [
              {
                "id": "A",
                "label": "A"
              }
            ],
            "params": {
              "coords": [
                0,
                0
              ]
            }
          },
          {
            "op": "construct",
            "command": "point.free",
            "outputs": [
              {
                "id": "B",
                "label": "B"
              }
            ],
            "params": {
              "coords": [
                5,
                0
              ]
            }
          },
          {
            "op": "construct",
            "command": "point.free",
            "outputs": [
              {
                "id": "C",
                "label": "C"
              }
            ],
            "params": {
              "coords": [
                0,
                4
              ]
            }
          },
          {
            "op": "construct",
            "command": "segment.through_points",
            "outputs": [
              {
                "id": "AB"
              }
            ],
            "inputs": [
              {
                "ref": "A"
              },
              {
                "ref": "B"
              }
            ]
          },
          {
            "op": "construct",
            "command": "segment.through_points",
            "outputs": [
              {
                "id": "AC"
              }
            ],
            "inputs": [
              {
                "ref": "A"
              },
              {
                "ref": "C"
              }
            ]
          },
          {
            "op": "construct",
            "command": "segment.through_points",
            "outputs": [
              {
                "id": "BC"
              }
            ],
            "inputs": [
              {
                "ref": "B"
              },
              {
                "ref": "C"
              }
            ]
          },
          {
            "op": "construct",
            "command": "polygon.vertices",
            "outputs": [
              {
                "id": "triangleABC"
              }
            ],
            "inputs": [
              {
                "ref": "A"
              },
              {
                "ref": "B"
              },
              {
                "ref": "C"
              }
            ]
          },
          {
            "op": "construct",
            "command": "angle.three_points",
            "outputs": [
              {
                "id": "angleA",
                "label": "90°"
              }
            ],
            "inputs": [
              {
                "ref": "B"
              },
              {
                "ref": "A"
              },
              {
                "ref": "C"
              }
            ],
            "params": {
              "radius": 0.5,
              "labelRadius": 0.95
            }
          },
          {
            "op": "construct",
            "command": "marker.right_angle",
            "outputs": [
              {
                "id": "rightA"
              }
            ],
            "inputs": [
              {
                "ref": "angleA"
              }
            ],
            "params": {
              "size": 0.35
            }
          },
          {
            "op": "add_assertion",
            "assertion": {
              "id": "right-condition",
              "predicate": "perpendicular",
              "arguments": [
                {
                  "ref": "AB"
                },
                {
                  "ref": "AC"
                }
              ],
              "tolerance": 0.000001,
              "message": "AB⊥AC。",
              "requiredMethod": "numeric"
            }
          },
          {
            "op": "set_style",
            "targets": [
              "AB",
              "AC",
              "BC",
              "triangleABC"
            ],
            "style": {
              "stroke": "#15365F",
              "strokeWidth": 2.3
            }
          },
          {
            "op": "set_style",
            "targets": [
              "angleA",
              "rightA"
            ],
            "style": {
              "stroke": "#0E8378",
              "fill": "#DCEFE7",
              "strokeWidth": 1.7,
              "fillOpacity": 0.14
            }
          },
          {
            "op": "set_style",
            "targets": [
              "triangleABC"
            ],
            "style": {
              "stroke": "#15365F",
              "fill": "#DCEFE7",
              "fillOpacity": 0.2,
              "strokeWidth": 2.3,
              "labelVisible": false
            }
          },
          {
            "op": "set_style",
            "targets": [
              "A",
              "B",
              "C"
            ],
            "style": {
              "pointSize": 5,
              "fontSize": 15,
              "labelPlacement": "auto"
            }
          }
        ],
        "metadata": {
          "origin": "textbook-case-source-faithful",
          "sourceFidelity": "A",
          "mathCorrectness": "verified",
          "visualQuality": "pending-browser-review"
        }
      }
    ]
  },
  "expected": {
    "documentFingerprint": "c98d152065c57587b452a22bf7bb96a7ad7bf6fd91f54712469b7a8919c62976",
    "assertions": [
      {
        "kind": "entity-exists",
        "entityIds": [
          "A",
          "B",
          "C",
          "AB",
          "AC",
          "BC",
          "triangleABC",
          "angleA"
        ]
      },
      {
        "kind": "runtime-assertions-pass"
      },
      {
        "kind": "activity-stages",
        "minimum": 3
      },
      {
        "kind": "static-render"
      },
      {
        "kind": "render-bundle"
      }
    ],
    "interactions": []
  },
  "artifacts": {},
  "status": "accepted",
  "diagnostics": []
}
