{
  "schema": "famtutor.case.v1",
  "caseId": "zj8a-1-1-07-altitudes",
  "title": "比较三类三角形中高的位置",
  "description": "并列构造锐角、直角和钝角示例，观察从一个顶点到对边所在直线的高。",
  "source": { "bookId": "zjedu-math-8a-2013", "pdfName": "义务教育教科书·数学八年级上册.pdf", "pdfSha256": "d0888daf868964e0b04a7b22f09b24fa24b001becf7c3a617c5f799f1fa078f2", "chapter": "1 三角形的初步知识", "section": "1.1 认识三角形", "printedPages": [8], "pdfPages": [11], "extractionMethod": "visual-review", "confidence": 1, "reviewStatus": "reviewed" },
  "knowledgePoints": ["altitude", "triangle-classification"],
  "learningObjective": "比较不同类型三角形中高相对三角形内部、边上和外部的位置。",
  "caseType": "exploration",
  "difficulty": "intermediate",
  "requiredCapabilities": ["line.perpendicular_through", "point.intersection_line_line", "assertion.perpendicular", "interaction.drag"],
  "generation": { "provider": "openai-codex", "model": "gpt-5", "promptVersion": "pr6-seed-v1", "seed": 107, "attempts": 1 },
  "inputs": { "initialDocument": { "schema": "famtutor.math.document.v1", "documentId": "altitudes-07", "revision": 1, "seed": 107, "metadata": { "title": "三类三角形中的高", "locale": "zh-CN", "purpose": "exploration", "subject": "mathematics", "grade": "grade-8" }, "entities": [], "construction": [], "views": [{ "id": "main", "kind": "graphics2d", "visible": true, "renderer": "jsxgraph-svg", "boundingBox": [-11, 6, 12, -3], "axes": false, "grid": false, "keepAspectRatio": true }], "activities": [{ "id": "compare-altitudes", "title": "比较高的位置", "stages": [{ "id": "acute", "narration": "观察锐角三角形的高。", "focus": ["altA"] }, { "id": "right", "narration": "观察直角三角形的高。", "focus": ["altP"] }, { "id": "obtuse", "narration": "观察钝角三角形延长线上的高。", "focus": ["altU"] }] }], "provenance": { "generator": "agent", "sourceRefs": ["zjedu-math-8a-2013:printed-8"] } } },
  "trace": { "changeSets": [{ "schema": "famtutor.engine.change-set.v1", "changeSetId": "zj8a-07-build", "base": { "domain": "math", "schema": "famtutor.math.document.v1", "documentId": "altitudes-07", "revision": 1 }, "operations": [
    { "op": "construct", "command": "point.free", "outputs": [{ "id": "A", "label": "A" }], "params": { "coords": [-7, 4] } },
    { "op": "construct", "command": "point.free", "outputs": [{ "id": "B", "label": "B" }], "params": { "coords": [-10, 0] } },
    { "op": "construct", "command": "point.free", "outputs": [{ "id": "C", "label": "C" }], "params": { "coords": [-4, 0] } },
    { "op": "construct", "command": "polygon.vertices", "outputs": [{ "id": "acuteTriangle", "label": "锐角" }], "inputs": [{ "ref": "A" }, { "ref": "B" }, { "ref": "C" }] },
    { "op": "construct", "command": "line.through_points", "outputs": [{ "id": "sideBC" }], "inputs": [{ "ref": "B" }, { "ref": "C" }] },
    { "op": "construct", "command": "line.perpendicular_through", "outputs": [{ "id": "altA", "label": "高" }], "inputs": [{ "ref": "A" }, { "ref": "sideBC" }] },
    { "op": "construct", "command": "point.intersection_line_line", "outputs": [{ "id": "footA", "label": "H₁" }], "inputs": [{ "ref": "altA" }, { "ref": "sideBC" }] },
    { "op": "construct", "command": "point.free", "outputs": [{ "id": "P", "label": "P" }], "params": { "coords": [0, 4] } },
    { "op": "construct", "command": "point.free", "outputs": [{ "id": "Q", "label": "Q" }], "params": { "coords": [0, 0] } },
    { "op": "construct", "command": "point.free", "outputs": [{ "id": "R", "label": "R" }], "params": { "coords": [4, 0] } },
    { "op": "construct", "command": "polygon.vertices", "outputs": [{ "id": "rightTriangle", "label": "直角" }], "inputs": [{ "ref": "P" }, { "ref": "Q" }, { "ref": "R" }] },
    { "op": "construct", "command": "line.through_points", "outputs": [{ "id": "sideQR" }], "inputs": [{ "ref": "Q" }, { "ref": "R" }] },
    { "op": "construct", "command": "line.perpendicular_through", "outputs": [{ "id": "altP", "label": "高" }], "inputs": [{ "ref": "P" }, { "ref": "sideQR" }] },
    { "op": "construct", "command": "point.intersection_line_line", "outputs": [{ "id": "footP", "label": "H₂" }], "inputs": [{ "ref": "altP" }, { "ref": "sideQR" }] },
    { "op": "construct", "command": "point.free", "outputs": [{ "id": "U", "label": "U" }], "params": { "coords": [5, 3] } },
    { "op": "construct", "command": "point.free", "outputs": [{ "id": "V", "label": "V" }], "params": { "coords": [7, 0] } },
    { "op": "construct", "command": "point.free", "outputs": [{ "id": "W", "label": "W" }], "params": { "coords": [11, 0] } },
    { "op": "construct", "command": "polygon.vertices", "outputs": [{ "id": "obtuseTriangle", "label": "钝角" }], "inputs": [{ "ref": "U" }, { "ref": "V" }, { "ref": "W" }] },
    { "op": "construct", "command": "line.through_points", "outputs": [{ "id": "sideVW" }], "inputs": [{ "ref": "V" }, { "ref": "W" }] },
    { "op": "construct", "command": "line.perpendicular_through", "outputs": [{ "id": "altU", "label": "高" }], "inputs": [{ "ref": "U" }, { "ref": "sideVW" }] },
    { "op": "construct", "command": "point.intersection_line_line", "outputs": [{ "id": "footU", "label": "H₃" }], "inputs": [{ "ref": "altU" }, { "ref": "sideVW" }] },
    { "op": "set_interaction", "policy": { "target": "A", "permissions": ["select", "drag"], "dragMode": "free" } },
    { "op": "set_interaction", "policy": { "target": "P", "permissions": ["select", "drag"], "dragMode": "free" } },
    { "op": "set_interaction", "policy": { "target": "U", "permissions": ["select", "drag"], "dragMode": "free" } },
    { "op": "add_assertion", "assertion": { "id": "acute-altitude-perpendicular", "predicate": "perpendicular", "arguments": [{ "ref": "altA" }, { "ref": "sideBC" }], "requiredMethod": "construction" } },
    { "op": "add_assertion", "assertion": { "id": "right-altitude-perpendicular", "predicate": "perpendicular", "arguments": [{ "ref": "altP" }, { "ref": "sideQR" }], "requiredMethod": "construction" } },
    { "op": "add_assertion", "assertion": { "id": "obtuse-altitude-perpendicular", "predicate": "perpendicular", "arguments": [{ "ref": "altU" }, { "ref": "sideVW" }], "requiredMethod": "construction" } }
  ], "metadata": { "origin": "textbook-case-seed" } }] },
  "expected": { "documentFingerprint": "ec26868b73b0fc3c62e86d9a534bb250ed37a1e238f905532cf8db95ae62ea07", "assertions": [{ "kind": "entity-exists", "entityIds": ["acuteTriangle", "rightTriangle", "obtuseTriangle", "altA", "altP", "altU", "footA", "footP", "footU"] }, { "kind": "runtime-assertions-pass" }, { "kind": "activity-stages", "minimum": 3 }, { "kind": "static-render" }, { "kind": "render-bundle" }], "interactions": [{ "target": "A", "permission": "drag" }, { "target": "P", "permission": "drag" }, { "target": "U", "permission": "drag" }] },
  "artifacts": {}, "status": "accepted", "diagnostics": []
}
