{
  "schema": "famtutor.case.v1",
  "caseId": "zj8a-1-4-19-congruent-figures",
  "title": "翻折后能够重合的图形",
  "description": "用一个非对称多边形及其镜像建立“能够重合的两个图形称为全等图形”的定义。",
  "source": { "bookId": "zjedu-math-8a-2013", "pdfName": "义务教育教科书·数学八年级上册.pdf", "pdfSha256": "d0888daf868964e0b04a7b22f09b24fa24b001becf7c3a617c5f799f1fa078f2", "chapter": "1 三角形的初步知识", "section": "1.4 全等三角形", "printedPages": [22], "pdfPages": [25], "extractionMethod": "visual-review", "confidence": 1, "reviewStatus": "reviewed" },
  "knowledgePoints": ["congruent-figures"],
  "learningObjective": "观察一对图形经翻折后逐点重合，理解全等图形只要求形状和大小相同，位置和方向可以不同。",
  "caseType": "demonstration",
  "difficulty": "introductory",
  "requiredCapabilities": ["polygon.vertices", "line.through_points", "transform.reflect", "transform.apply", "assertion.coincident", "activity.stages"],
  "generation": { "provider": "openai-codex", "model": "gpt-5", "promptVersion": "ch1-1.4-source-faithful-v1", "seed": 119, "attempts": 1 },
  "inputs": { "initialDocument": { "schema": "famtutor.math.document.v1", "documentId": "congruent-figures-19", "revision": 1, "seed": 119, "metadata": { "title": "翻折后能够重合的图形", "locale": "zh-CN", "purpose": "demonstration", "subject": "mathematics", "grade": "grade-8", "tags": ["1.4", "图1-17", "全等图形"] }, "entities": [], "construction": [], "views": [{ "id": "main", "kind": "graphics2d", "visible": true, "renderer": "jsxgraph-svg", "boundingBox": [-6.5, 4.5, 6.5, -4.5], "axes": false, "grid": false, "keepAspectRatio": true, "background": "#FAF8F2" }], "activities": [{ "id": "overlap-congruent-figures", "title": "翻折并观察重合", "stages": [
    { "id": "source", "narration": "观察左侧的非对称图形，先记住它的形状和大小。", "reveal": ["sourceShape"] },
    { "id": "pair", "narration": "右侧图形只是方向不同；它由左侧图形关于虚线镜像得到。", "reveal": ["sourceShape", "targetShape", "foldAxis"] },
    { "id": "fold", "narration": "沿虚线翻折，右侧图形的五个顶点分别回到左侧对应顶点。", "reveal": ["sourceShape", "targetShape", "foldAxis", "backShape"] },
    { "id": "conclude", "narration": "翻折后边界完全重合，所以这两个图形形状、大小相同，是全等图形。", "reveal": ["sourceShape", "backShape"] }
  ] }], "provenance": { "generator": "agent", "sourceRefs": ["zjedu-math-8a-2013:printed-22:figure-1-17"] } } },
  "trace": { "changeSets": [{ "schema": "famtutor.engine.change-set.v1", "changeSetId": "zj8a-19-build", "base": { "domain": "math", "schema": "famtutor.math.document.v1", "documentId": "congruent-figures-19", "revision": 1 }, "operations": [
    { "op": "construct", "command": "point.free", "outputs": [{ "id": "P1", "visible": false }], "params": { "coords": [-5, -1.5] } },
    { "op": "construct", "command": "point.free", "outputs": [{ "id": "P2", "visible": false }], "params": { "coords": [-3.7, -2.7] } },
    { "op": "construct", "command": "point.free", "outputs": [{ "id": "P3", "visible": false }], "params": { "coords": [-1.8, -1.7] } },
    { "op": "construct", "command": "point.free", "outputs": [{ "id": "P4", "visible": false }], "params": { "coords": [-2.5, 1.9] } },
    { "op": "construct", "command": "point.free", "outputs": [{ "id": "P5", "visible": false }], "params": { "coords": [-4.6, 2.5] } },
    { "op": "construct", "command": "polygon.vertices", "outputs": [{ "id": "sourceShape", "label": "图形 1" }], "inputs": [{ "ref": "P1" }, { "ref": "P2" }, { "ref": "P3" }, { "ref": "P4" }, { "ref": "P5" }] },
    { "op": "construct", "command": "point.free", "outputs": [{ "id": "X1", "visible": false }], "params": { "coords": [0, -3.6] } },
    { "op": "construct", "command": "point.free", "outputs": [{ "id": "X2", "visible": false }], "params": { "coords": [0, 3.6] } },
    { "op": "construct", "command": "line.through_points", "outputs": [{ "id": "foldAxis" }], "inputs": [{ "ref": "X1" }, { "ref": "X2" }] },
    { "op": "construct", "command": "transform.reflect", "outputs": [{ "id": "foldTransform" }], "inputs": [{ "ref": "foldAxis" }] },
    { "op": "construct", "command": "transform.apply", "outputs": [{ "id": "Q1", "type": "point2", "visible": false }], "inputs": [{ "ref": "P1" }, { "ref": "foldTransform" }] },
    { "op": "construct", "command": "transform.apply", "outputs": [{ "id": "Q2", "type": "point2", "visible": false }], "inputs": [{ "ref": "P2" }, { "ref": "foldTransform" }] },
    { "op": "construct", "command": "transform.apply", "outputs": [{ "id": "Q3", "type": "point2", "visible": false }], "inputs": [{ "ref": "P3" }, { "ref": "foldTransform" }] },
    { "op": "construct", "command": "transform.apply", "outputs": [{ "id": "Q4", "type": "point2", "visible": false }], "inputs": [{ "ref": "P4" }, { "ref": "foldTransform" }] },
    { "op": "construct", "command": "transform.apply", "outputs": [{ "id": "Q5", "type": "point2", "visible": false }], "inputs": [{ "ref": "P5" }, { "ref": "foldTransform" }] },
    { "op": "construct", "command": "polygon.vertices", "outputs": [{ "id": "targetShape", "label": "图形 2" }], "inputs": [{ "ref": "Q1" }, { "ref": "Q2" }, { "ref": "Q3" }, { "ref": "Q4" }, { "ref": "Q5" }] },
    { "op": "construct", "command": "transform.apply", "outputs": [{ "id": "backShape", "type": "polygon2" }], "inputs": [{ "ref": "targetShape" }, { "ref": "foldTransform" }] },
    { "op": "construct", "command": "transform.apply", "outputs": [{ "id": "P1back", "type": "point2", "visible": false }], "inputs": [{ "ref": "Q1" }, { "ref": "foldTransform" }] },
    { "op": "construct", "command": "transform.apply", "outputs": [{ "id": "P3back", "type": "point2", "visible": false }], "inputs": [{ "ref": "Q3" }, { "ref": "foldTransform" }] },
    { "op": "construct", "command": "transform.apply", "outputs": [{ "id": "P5back", "type": "point2", "visible": false }], "inputs": [{ "ref": "Q5" }, { "ref": "foldTransform" }] },
    { "op": "set_style", "targets": ["sourceShape"], "style": { "stroke": "#15365F", "fill": "#DCEFE7", "strokeWidth": 2.5, "fillOpacity": 0.65, "fontSize": 15 } },
    { "op": "set_style", "targets": ["targetShape"], "style": { "stroke": "#EF6C22", "fill": "#FBE6D7", "strokeWidth": 2.5, "fillOpacity": 0.55, "fontSize": 15 } },
    { "op": "set_style", "targets": ["backShape"], "style": { "stroke": "#0E8378", "fill": "#DCEFE7", "strokeWidth": 3.4, "fillOpacity": 0.18, "dash": "dashed" } },
    { "op": "set_style", "targets": ["foldAxis"], "style": { "stroke": "#2E6DB2", "strokeWidth": 1.8, "opacity": 0.7, "dash": "dashed" } },
    { "op": "add_assertion", "assertion": { "id": "p1-folds-back", "predicate": "coincident", "arguments": [{ "ref": "P1" }, { "ref": "P1back" }], "tolerance": 1e-10, "message": "第一个对应顶点翻折后重合。" } },
    { "op": "add_assertion", "assertion": { "id": "p3-folds-back", "predicate": "coincident", "arguments": [{ "ref": "P3" }, { "ref": "P3back" }], "tolerance": 1e-10, "message": "第三个对应顶点翻折后重合。" } },
    { "op": "add_assertion", "assertion": { "id": "p5-folds-back", "predicate": "coincident", "arguments": [{ "ref": "P5" }, { "ref": "P5back" }], "tolerance": 1e-10, "message": "第五个对应顶点翻折后重合。" } }
  ], "metadata": { "origin": "textbook-case-source-faithful", "sourceFidelity": "A", "mathCorrectness": "verified", "visualQuality": "pending-browser-review" } }] },
  "expected": { "documentFingerprint": "a46a0f235dd4e049065e3addd1096936ac41a7b821984a0b15dfaecd18827ba6", "assertions": [{ "kind": "entity-exists", "entityIds": ["sourceShape", "targetShape", "foldAxis", "foldTransform", "backShape", "P1back", "P3back", "P5back"] }, { "kind": "entity-types", "types": { "sourceShape": "polygon2", "targetShape": "polygon2", "foldTransform": "transform2", "backShape": "polygon2" } }, { "kind": "runtime-assertions-pass" }, { "kind": "activity-stages", "minimum": 4 }, { "kind": "static-render" }, { "kind": "render-bundle" }], "interactions": [] },
  "artifacts": {}, "status": "accepted", "diagnostics": []
}
