{
  "schema": "famtutor.case.v1",
  "caseId": "zj8a-1-1-03-triangle-inequality",
  "title": "用 3、4、5 三边验证三角形三边关系",
  "description": "构造边长为 3、4、5 的三角形，以可计算长度支持任意两边之和大于第三边的观察。",
  "source": { "bookId": "zjedu-math-8a-2013", "pdfName": "义务教育教科书·数学八年级上册.pdf", "pdfSha256": "d0888daf868964e0b04a7b22f09b24fa24b001becf7c3a617c5f799f1fa078f2", "chapter": "1 三角形的初步知识", "section": "1.1 认识三角形", "printedPages": [5], "pdfPages": [8], "extractionMethod": "visual-review", "confidence": 1, "reviewStatus": "reviewed" },
  "knowledgePoints": ["triangle-inequality"],
  "learningObjective": "根据三条边的长度检验三角形三边关系。",
  "caseType": "demonstration",
  "difficulty": "introductory",
  "requiredCapabilities": ["point.free", "segment.through_points", "measurement.distance", "assertion.expression_equal"],
  "generation": { "provider": "openai-codex", "model": "gpt-5", "promptVersion": "pr6-seed-v1", "seed": 103, "attempts": 1 },
  "inputs": { "initialDocument": { "schema": "famtutor.math.document.v1", "documentId": "triangle-inequality-03", "revision": 1, "seed": 103, "metadata": { "title": "三角形三边关系", "locale": "zh-CN", "purpose": "demonstration", "subject": "mathematics", "grade": "grade-8" }, "entities": [], "construction": [], "views": [{ "id": "main", "kind": "graphics2d", "visible": true, "renderer": "jsxgraph-svg", "boundingBox": [-1, 5, 5, -1], "axes": false, "grid": false, "keepAspectRatio": true }], "activities": [{ "id": "compare-sides", "title": "比较边长", "stages": [{ "id": "measure", "narration": "先量出三条边。" }, { "id": "compare", "narration": "逐组比较两边之和与第三边。" }] }], "provenance": { "generator": "agent", "sourceRefs": ["zjedu-math-8a-2013:printed-5"] } } },
  "trace": { "changeSets": [{ "schema": "famtutor.engine.change-set.v1", "changeSetId": "zj8a-03-build", "base": { "domain": "math", "schema": "famtutor.math.document.v1", "documentId": "triangle-inequality-03", "revision": 1 }, "operations": [
    { "op": "construct", "command": "point.free", "outputs": [{ "id": "A", "label": "A" }], "params": { "coords": [0, 0] } },
    { "op": "construct", "command": "point.free", "outputs": [{ "id": "B", "label": "B" }], "params": { "coords": [3, 0] } },
    { "op": "construct", "command": "point.free", "outputs": [{ "id": "C", "label": "C" }], "params": { "coords": [0, 4] } },
    { "op": "construct", "command": "segment.through_points", "outputs": [{ "id": "AB", "label": "3" }], "inputs": [{ "ref": "A" }, { "ref": "B" }] },
    { "op": "construct", "command": "segment.through_points", "outputs": [{ "id": "BC", "label": "5" }], "inputs": [{ "ref": "B" }, { "ref": "C" }] },
    { "op": "construct", "command": "segment.through_points", "outputs": [{ "id": "CA", "label": "4" }], "inputs": [{ "ref": "C" }, { "ref": "A" }] },
    { "op": "add_assertion", "assertion": { "id": "length-ab", "predicate": "expression_equal", "arguments": [{ "expr": "distance(A,B)" }, { "value": 3 }], "tolerance": 1e-9 } },
    { "op": "add_assertion", "assertion": { "id": "length-bc", "predicate": "expression_equal", "arguments": [{ "expr": "distance(B,C)" }, { "value": 5 }], "tolerance": 1e-9 } },
    { "op": "add_assertion", "assertion": { "id": "length-ca", "predicate": "expression_equal", "arguments": [{ "expr": "distance(C,A)" }, { "value": 4 }], "tolerance": 1e-9 } }
  ], "metadata": { "origin": "textbook-case-seed" } }] },
  "expected": { "documentFingerprint": "dfe8a71ab4d4f2cf780290c7fe952d138ba2c6a9747c9ee64c7667b18680c041", "assertions": [{ "kind": "entity-exists", "entityIds": ["A", "B", "C", "AB", "BC", "CA"] }, { "kind": "runtime-assertions-pass" }, { "kind": "activity-stages", "minimum": 2 }, { "kind": "static-render" }, { "kind": "render-bundle" }], "interactions": [] },
  "artifacts": {}, "status": "accepted", "diagnostics": []
}
